{
  "schemaVersion": 1,
  "messageType": "RequirementsHandoff",
  "workflowId": "11111111-1111-4111-8111-111111111111",
  "handoffId": "aaaaaaaaaaaaaaaaaaaaaaaaaaaaaaaaaaaaaaaaaaaaaaaaaaaaaaaaaaaaaaaa",
  "repository": {
    "key": "0123456789abcdef01234567",
    "origin": "ssh://github.com/acme/project"
  },
  "feature": {
    "slug": "device-loan",
    "title": "Device loan workflow",
    "branch": "codex/device-loan",
    "requirementsPath": "docs/feature/device-loan/requirements.md",
    "requirementsCommitSha": "1111111111111111111111111111111111111111",
    "requirementsSha256": "bbbbbbbbbbbbbbbbbbbbbbbbbbbbbbbbbbbbbbbbbbbbbbbbbbbbbbbbbbbbbbbb"
  },
  "confirmation": {
    "status": "CONFIRMED",
    "confirmedBy": "User in Requirements task",
    "confirmedAt": "2026-07-25T10:00:00Z",
    "evidence": "User explicitly confirmed the current requirements snapshot."
  },
  "routes": {
    "sourceThreadId": "requirements-thread",
    "destinationThreadId": "main-thread"
  },
  "createdAt": "2026-07-25T10:01:00Z"
}
